<?xml version="1.0" encoding="UTF-8"?>
<!DOCTYPE personas SYSTEM "prueba.dtd">
<personas>
    <persona>
        <nombre>Juan</nombre>
        <apellido>Pardo</apellido>
        <nacimiento dia="26" mes="abril" anyo="1995"/>
        <direccion>
            <calle>Maricarmen Villavieja</calle>
            <poblacion>Gijon</poblacion>
            <cpostal>33207</cpostal>
        </direccion>
        <varon/>
    </persona>
    <persona>
        <nombre>Maria</nombre>
        <nacimiento dia="30" mes="Mayo" anyo="2000"/>
        <direccion>
            <calle>Teodoro Cuesta</calle>
            <provincia>Asturias</provincia>
            <cpostal>33208</cpostal>
        </direccion>
    </persona>
    <persona>
        <nombre>Pelayo</nombre>
        <apellido>Gonzalez</apellido>
        <apellido>Garcia</apellido>
        <direccion>
            <provincia>Catalu√±a</provincia>
            <cpostal>33100</cpostal>
        </direccion>
        <varon/>
    </persona>
</personas>